{
    "servient": {
        "scriptDir": ".",
        "scriptAction": true
    },
    "http": {
        "port": 8080,
        "allowSelfSigned": true
    },
    "mqtt" : {
        "uri" : "mqtt://test.mosquitto.org",
        "port": 1883 
    },
    "log": {
        "level": "info"
    },
    "credentials": {
        "urn:dev:wot:org:eclipse:leshan": {
            "identity": "node-wot",
            "psk": "hello"
        }
    }
}
